CHAVE DE ACESSO,MODELO,SÉRIE,NÚMERO,NATUREZA DA OPERAÇÃO,DATA EMISSÃO,EVENTO MAIS RECENTE,DATA/HORA EVENTO MAIS RECENTE,CPF/CNPJ Emitente,RAZÃO SOCIAL EMITENTE,INSCRIÇÃO ESTADUAL EMITENTE,UF EMITENTE,MUNICÍPIO EMITENTE,CNPJ DESTINATÁRIO,NOME DESTINATÁRIO,UF DESTINATÁRIO,INDICADOR IE DESTINATÁRIO,DESTINO DA OPERAÇÃO,CONSUMIDOR FINAL,PRESENÇA DO COMPRADOR,VALOR NOTA FISCAL
24020116828124205781822019597778659028036536,55 - NF-E EMITIDA EM SUBSTITUIÇÃO AO MODELO 1 OU 1A,890,2600094,S,2024-02-19 01:05:07,Autorização de Uso,2024-02-19 01:06:07,***.152.402-**,ANTONIO DE PAIVA COSTA,-1,PA,OBIDOS,5526783000408,"MINISTERIO DO DESENVOLVIMENTO SOCIAL, FAMILIA E COMBATE A FO",DF,NÃO CONTRIBUINTE,2 - OPERAÇÃO INTERESTADUAL,1 - CONSUMIDOR FINAL,0 - NÃO SE APLICA,2182.46
24020134423629923010588251884671062509094586,55 - NF-E EMITIDA EM SUBSTITUIÇÃO AO MODELO 1 OU 1A,0,129832,Outra entrada de mercadoria ou prestacao de servico nao espe,2024-02-07 21:55:35,Autorização de Uso,2024-02-07 21:57:35,03605534000130,AVFARMA ASSIST. SERV. FARMACEUTICOS LTDA,77899618,RJ,RIO DE JANEIRO,34023077000280,HOSPITAL UNIVERSITARIO GAFFREE E GUINLE,RJ,CONTRIBUINTE ISENTO,1 - OPERAÇÃO INTERNA,0 - NORMAL,0 - NÃO SE APLICA,12947.4
24020100873450877388878780841809691589609966,55 - NF-E EMITIDA EM SUBSTITUIÇÃO AO MODELO 1 OU 1A,1,368082,RETORNO DE MATERIAL DEPOSITADO EM ARMAZEM GERAL,2024-02-05 12:02:01,Autorização de Uso,2024-02-05 12:07:01,34028316923228,EMPRES BRASILEIRA DE CORREIOS E TELEGRAFOS,112388853119,SP,CAJAMAR,378257000181,FUNDO NACIONAL DE DESENVOLVIMENTO DA EDUCACAO,DF,NÃO CONTRIBUINTE,2 - OPERAÇÃO INTERESTADUAL,1 - CONSUMIDOR FINAL,0 - NÃO SE APLICA,282.34
24020104054616935751474991929670659909257828,55 - NF-E EMITIDA EM SUBSTITUIÇÃO AO MODELO 1 OU 1A,1,366295,RETORNO DE MATERIAL DEPOSITADO EM ARMAZEM GERAL,2024-02-04 04:19:39,Autorização de Uso,2024-02-04 04:20:39,34028316923228,EMPRES BRASILEIRA DE CORREIOS E TELEGRAFOS,112388853119,SP,CAJAMAR,378257000181,FUNDO NACIONAL DE DESENVOLVIMENTO DA EDUCACAO,DF,NÃO CONTRIBUINTE,2 - OPERAÇÃO INTERESTADUAL,1 - CONSUMIDOR FINAL,0 - NÃO SE APLICA,124.52
24020103837773296931471992285542479686539550,55 - NF-E EMITIDA EM SUBSTITUIÇÃO AO MODELO 1 OU 1A,2,728511,OUTRAS SAIDAS,2024-02-05 20:14:50,Autorização de Uso,2024-02-05 20:22:50,34164319000506,CASA DA MOEDA DO BRASIL,82346988,RJ,RIO DE JANEIRO,394494003585,MINISTERIO DA JUSTICA E SEGURANCA PUBLICA,RJ,NÃO CONTRIBUINTE,1 - OPERAÇÃO INTERNA,1 - CONSUMIDOR FINAL,0 - NÃO SE APLICA,13935.55
24020197286945799143946785628700762421824655,55 - NF-E EMITIDA EM SUBSTITUIÇÃO AO MODELO 1 OU 1A,1,3386,VENDA,2024-02-15 14:28:10,Autorização de Uso,2024-02-15 14:38:10,78796778000146,G DE BORBA - MARISKAP,1016202980,PR,CURITIBA,394429005927,COMANDO DA AERONAUTICA,DF,NÃO CONTRIBUINTE,2 - OPERAÇÃO INTERESTADUAL,1 - CONSUMIDOR FINAL,0 - NÃO SE APLICA,3318.92
24020158650284315121394279645118850902727523,55 - NF-E EMITIDA EM SUBSTITUIÇÃO AO MODELO 1 OU 1A,1,10849,Remessa de mercadoria em consignacao mercantil ou industrial,2024-02-14 10:47:38,Autorização de Uso,2024-02-14 10:50:38,23651234000102,ARTE IMPLANTES MATERIAIS CIRURGICOS LTDA,153595339115,SP,SAO PAULO,10360293000252,HOSPITAL MILITAR DE AREA DE PORTO ALEGRE,RS,NÃO CONTRIBUINTE,2 - OPERAÇÃO INTERESTADUAL,1 - CONSUMIDOR FINAL,"9 - OPERAÇÃO NÃO PRESENCIAL, OUTROS",29466.67
