CHAVE DE ACESSO,MODELO,SÉRIE,NÚMERO,NATUREZA DA OPERAÇÃO,DATA EMISSÃO,EVENTO MAIS RECENTE,DATA/HORA EVENTO MAIS RECENTE,CPF/CNPJ Emitente,RAZÃO SOCIAL EMITENTE,INSCRIÇÃO ESTADUAL EMITENTE,UF EMITENTE,MUNICÍPIO EMITENTE,CNPJ DESTINATÁRIO,NOME DESTINATÁRIO,UF DESTINATÁRIO,INDICADOR IE DESTINATÁRIO,DESTINO DA OPERAÇÃO,CONSUMIDOR FINAL,PRESENÇA DO COMPRADOR,VALOR NOTA FISCAL
24120163445286649260603920493794665448079497,55 - NF-E EMITIDA EM SUBSTITUIÇÃO AO MODELO 1 OU 1A,100,16967,REMESSA - ENTREGA FUTURA,2024-12-09 11:38:38,Autorização de Uso,2024-12-09 11:40:38,61186490000157,EDITORA FTD S.A.,104639530113,SP,SAO PAULO,378257000181,FUNDO NACIONAL DE DESENVOLVIMENTO DA EDUCACAO,DF,NÃO CONTRIBUINTE,2 - OPERAÇÃO INTERESTADUAL,1 - CONSUMIDOR FINAL,"9 - OPERAÇÃO NÃO PRESENCIAL, OUTROS",284507.16
24120119749763686149718821286006503776235375,55 - NF-E EMITIDA EM SUBSTITUIÇÃO AO MODELO 1 OU 1A,1,368287,RETORNO DE MATERIAL DEPOSITADO EM ARMAZEM GERAL,2024-12-30 00:31:46,Autorização de Uso,2024-12-30 00:32:46,34028316923228,EMPRES BRASILEIRA DE CORREIOS E TELEGRAFOS,112388853119,SP,CAJAMAR,378257000181,FUNDO NACIONAL DE DESENVOLVIMENTO DA EDUCACAO,DF,NÃO CONTRIBUINTE,2 - OPERAÇÃO INTERESTADUAL,1 - CONSUMIDOR FINAL,0 - NÃO SE APLICA,271.25
24120137499804400569446321362670837960091901,55 - NF-E EMITIDA EM SUBSTITUIÇÃO AO MODELO 1 OU 1A,3,134416,REMESSA EM COMODATO,2024-12-25 01:57:59,Autorização de Uso,2024-12-25 02:05:59,01559403000138,BIO 2 IMP. E COM DE MAT. MED. HOSP. LTDA,148787084119,SP,SAO PAULO,394429010688,COMANDO DA AERONAUTICA,SP,NÃO CONTRIBUINTE,1 - OPERAÇÃO INTERNA,1 - CONSUMIDOR FINAL,"9 - OPERAÇÃO NÃO PRESENCIAL, OUTROS",9709.69
24120185498552403980682706916583390828128521,55 - NF-E EMITIDA EM SUBSTITUIÇÃO AO MODELO 1 OU 1A,100,17055,REMESSA - ENTREGA FUTURA,2024-12-30 04:57:40,Autorização de Uso,2024-12-30 05:00:40,61186490000157,EDITORA FTD S.A.,104639530113,SP,SAO PAULO,378257000181,FUNDO NACIONAL DE DESENVOLVIMENTO DA EDUCACAO,DF,NÃO CONTRIBUINTE,2 - OPERAÇÃO INTERESTADUAL,1 - CONSUMIDOR FINAL,"9 - OPERAÇÃO NÃO PRESENCIAL, OUTROS",7329.39
24120157339350620721724287456521927556996119,55 - NF-E EMITIDA EM SUBSTITUIÇÃO AO MODELO 1 OU 1A,1,21435,VENDA DE MERCADORIA ADQUIRIDA OU RECEBIDA DE TERCEIROS EM OP,2024-12-29 19:00:05,Autorização de Uso,2024-12-29 19:07:05,14124286000121,MAVI CONSTRUCOES - LTDA,65721551,CE,FORTALEZA,394502011693,ESCOLA DE APRENDIZES MARINHEIROS DO CEARA,CE,NÃO CONTRIBUINTE,1 - OPERAÇÃO INTERNA,1 - CONSUMIDOR FINAL,1 - OPERAÇÃO PRESENCIAL,401.74
24120147824726239091373666784329554624055348,55 - NF-E EMITIDA EM SUBSTITUIÇÃO AO MODELO 1 OU 1A,1,328041,"VENDA DE MERCADORIA ADQ OU RECEB DE TERC, DEST A NAO CONTRIB",2024-12-21 10:38:09,Autorização de Uso,2024-12-21 10:48:09,12889035000102,INOVAMED HOSPITALAR LTDA,390157570,RS,ERECHIM,394544004172,MINISTERIO DA SAUDE DISTRITO SANITARIO ESPECIAL INDIGENA PE,PE,NÃO CONTRIBUINTE,2 - OPERAÇÃO INTERESTADUAL,1 - CONSUMIDOR FINAL,"9 - OPERAÇÃO NÃO PRESENCIAL, OUTROS",2095.79
24120112011233359996848745988467690188513118,55 - NF-E EMITIDA EM SUBSTITUIÇÃO AO MODELO 1 OU 1A,2,14163,"5656 Venda de combustivel ou lubrificante, adquiridos ou re",2024-12-06 14:30:21,Autorização de Uso,2024-12-06 14:35:21,29111673000109,DUME COMBUSTIVEIS BARRA DO GARCAS LTDA,137367414,MT,BARRA DO GARCAS,394429004017,COMANDO DA AERON&AACUTE;UTICA,DF,CONTRIBUINTE ISENTO,1 - OPERAÇÃO INTERNA,1 - CONSUMIDOR FINAL,1 - OPERAÇÃO PRESENCIAL,922.74
24120182307415866055667947570359630130831514,55 - NF-E EMITIDA EM SUBSTITUIÇÃO AO MODELO 1 OU 1A,1,77831,REMES MAT PREST SERV,2024-12-26 05:52:04,Autorização de Uso,2024-12-26 05:59:04,00323090000151,SOLL -SERVICOS OBRAS E LOCACOES LTDA,23874090,PE,OLINDA,394544004172,MINISTERIO DA SAUDE DISTRITO SANITARIO ESPECIAL INDIGENA PE,PE,NÃO CONTRIBUINTE,1 - OPERAÇÃO INTERNA,1 - CONSUMIDOR FINAL,"9 - OPERAÇÃO NÃO PRESENCIAL, OUTROS",544.06
24120135137215643048861782181567211115023513,55 - NF-E EMITIDA EM SUBSTITUIÇÃO AO MODELO 1 OU 1A,1,61513,VENDA DENTRO DO ESTADO,2024-12-29 20:33:02,Autorização de Uso,2024-12-29 20:37:02,24875483000136,ESSENCIAL RIO DISTRIB. DE PROD. MEDICOS E HOSPITALARES LTDA,87152596,RJ,NOVA IGUACU,9609235000230,HOSPITAL CENTRAL DO EXERCITO,RJ,NÃO CONTRIBUINTE,1 - OPERAÇÃO INTERNA,1 - CONSUMIDOR FINAL,0 - NÃO SE APLICA,9149.05
