CHAVE DE ACESSO,MODELO,SÉRIE,NÚMERO,NATUREZA DA OPERAÇÃO,DATA EMISSÃO,EVENTO MAIS RECENTE,DATA/HORA EVENTO MAIS RECENTE,CPF/CNPJ Emitente,RAZÃO SOCIAL EMITENTE,INSCRIÇÃO ESTADUAL EMITENTE,UF EMITENTE,MUNICÍPIO EMITENTE,CNPJ DESTINATÁRIO,NOME DESTINATÁRIO,UF DESTINATÁRIO,INDICADOR IE DESTINATÁRIO,DESTINO DA OPERAÇÃO,CONSUMIDOR FINAL,PRESENÇA DO COMPRADOR,VALOR NOTA FISCAL
25050164943624935376817358539567488103718648,55 - NF-E EMITIDA EM SUBSTITUIÇÃO AO MODELO 1 OU 1A,1,342,Venda Fora do Estado,2025-05-12 07:53:49,Autorização de Uso,2025-05-12 07:57:49,42933602000141,ZENITE COMERCIO E SUPRIMENTOS DE INFORMATICA LTDA,261222082,SC,SANTO AMARO DA IMPERATRIZ,10673078000120,"INSTITUTO FEDERAL DE EDUCACAO, CIENCIA E TECNOLOGIA- IFMS",MS,NÃO CONTRIBUINTE,2 - OPERAÇÃO INTERESTADUAL,1 - CONSUMIDOR FINAL,"2 - OPERAÇÃO NÃO PRESENCIAL, PELA INTERNET",589.03
25050153995162890830525784525279951407380034,55 - NF-E EMITIDA EM SUBSTITUIÇÃO AO MODELO 1 OU 1A,1,4162,VENDA DE MERCADORIA,2025-05-07 01:26:15,Autorização de Uso,2025-05-07 01:36:15,21793208000185,DF MAQUINAS E FERRAMENTAS LTDA,771188900164,DF,BRASILIA,394544004504,MINISTERIO DA SAUDE,MT,NÃO CONTRIBUINTE,2 - OPERAÇÃO INTERESTADUAL,1 - CONSUMIDOR FINAL,1 - OPERAÇÃO PRESENCIAL,3346.37
25050150410731207957951920718759374116668509,55 - NF-E EMITIDA EM SUBSTITUIÇÃO AO MODELO 1 OU 1A,1,369180,RETORNO DE MATERIAL DEPOSITADO EM ARMAZEM GERAL,2025-05-04 19:48:38,Autorização de Uso,2025-05-04 19:50:38,34028316923228,EMPRES BRASILEIRA DE CORREIOS E TELEGRAFOS,112388853119,SP,CAJAMAR,378257000181,FUNDO NACIONAL DE DESENVOLVIMENTO DA EDUCACAO,DF,NÃO CONTRIBUINTE,2 - OPERAÇÃO INTERESTADUAL,1 - CONSUMIDOR FINAL,0 - NÃO SE APLICA,278.24
25050158485482836907036842484946515781494870,55 - NF-E EMITIDA EM SUBSTITUIÇÃO AO MODELO 1 OU 1A,1,1027,5102,2025-05-25 12:11:45,Autorização de Uso,2025-05-25 12:16:45,07556125000141,F C SILVA COMERCIO DE INFORMATICA,77969845,RJ,VOLTA REDONDA,394502054589,COMANDO DA MARINHA,RJ,NÃO CONTRIBUINTE,1 - OPERAÇÃO INTERNA,1 - CONSUMIDOR FINAL,0 - NÃO SE APLICA,538.06
25050159582464666967714449191310272655222357,55 - NF-E EMITIDA EM SUBSTITUIÇÃO AO MODELO 1 OU 1A,1,366295,RETORNO DE MATERIAL DEPOSITADO EM ARMAZEM GERAL,2025-05-08 02:18:49,Autorização de Uso,2025-05-08 02:27:49,34028316923228,EMPRES BRASILEIRA DE CORREIOS E TELEGRAFOS,112388853119,SP,CAJAMAR,378257000181,FUNDO NACIONAL DE DESENVOLVIMENTO DA EDUCACAO,DF,NÃO CONTRIBUINTE,2 - OPERAÇÃO INTERESTADUAL,1 - CONSUMIDOR FINAL,0 - NÃO SE APLICA,128.25
25050185795926855145422020030634977819903169,55 - NF-E EMITIDA EM SUBSTITUIÇÃO AO MODELO 1 OU 1A,890,243008447,DA DE PRODUCAO DO ESTABELECIMENTO,2025-05-21 08:40:38,Autorização de Uso,2025-05-21 08:49:38,***.858.493-**,JUAREZ SILVA CABRAL,-1,MA,SAO LUIS,5526783000165,"MINISTERIO DO DESENVOLVIMENTO E ASSISTENCIA SOCIAL, FAMILIA",AM,NÃO CONTRIBUINTE,2 - OPERAÇÃO INTERESTADUAL,1 - CONSUMIDOR FINAL,0 - NÃO SE APLICA,841.79
